,Reviews
759,horrible staff. always rude. drive thru is a joke. check food because order accuracy does not exist. mcdonalds is a not corporation. the rich own them and hire the most disrespectful no knowledge having people. i bet if we boycott they (all the franchises mcdonald's) will get their act together. but who could resist a big mac. managers have no ethics of what customer service or management is.
760,"Yup same slow service. Its 1030 at night. I don't see the reason for this. If it was breakfast, lunch or dinner I can see being backed up. Its close to my house and just an easy place to run up too. There's nothing else really around that I am wanting to go to. Also the other places are usually closed around here."
761,"Not that pizza hut is very good anyway, but this location can never get deliveries right and cancels your orders after over an hour waiting with no notification. This us the second time to happen. Not only that, they really don't care about it either. Never again"
762,"My brother had ordered at the kiosk and got charged but the order did not go through their screen so they made him pay again and I saw that they charged twice so I went over and told them the problem nicely and the cashier told me that it didn't show up on their screen soo & I told her I had the proof on my phone so she got a manager. This problem has also happened at McDonald's on Kennedy kiosk and the manager there had told me that the kiosk was having problems. So the manager at this location was upset she was very unprofessional when I told her she was hesitant to give me a refund WHEN I HAD RECIPIENTS and showed her why would I be lying when I have proof I also told her that the same situation had happened at the Kennedys location & it must be the kiosk & she rudely said ""OK GO BACK TO KENNEDY THEN"" I was shook at that comment I was going to snap on her for being disrespectful but she's old and she might have a stroke and I wouldn't like for that to happen to her I hope this establishment realizes the kind of manager they have ridiculous this was also my first time coming to this location and will be my last"
763,"Honestly this is pretty much the worst McDonald's of all time.  The drive through is slower than Steak 'n Shake and once you get up to the microphone they take forever to take your order, i honestly can't understand how it's so much worse than other McDonald's.  I would have saved time driving over to Hanley even though this was right on my way.
final wait time: TWENTY FIVE MINUTES for two happy meals and two Big Mac meals, no special requests."
764,They messed up my order twice they said that they were going to deliver and eventually delivered to another address so they messed up i called again AND GOT HUNG UP ON ONCE then finally they answered after calling three times for being on hold they said they were going to send me a free order at the right Address and that was it someone else called me back and said they had cancelled my order and my money will be sent back but they had just said they were going to deliver now I'm left with nothing but disrespect they are unprofessional they are rude and I'm never ordering from there ever again
765,Cold hash browns. This McDonald's ALWAYS has cold hash browns. And the service is by far the worst of all the McDonald's restaurants I've visited in my lifet. I've given this particular McDonald's several chances to redeem themselves and they've managed to fail every time. This place is a joke
766,Watch out for the cockroaches!  I sat down for lunch today and one ran from under the napkin dispenser into the middle of the table. It doesn't look like anyone is taking time to clean under the tables or along the walls.  I can't imagine what the kitchen looks like. I had no plans to try the Sushi and would recommend avoiding the place all together.
767,"Food poisoning extravaganza, with a smile. I write this as I am up with a case of food poisoning at 2:30 am. While the people who work here are courteous and keep inviting you back, there's no mistaking that the food is totally lacking to the point of being unsafe. We ate here a little after 8 pm, and found a very narrow selection of Asian food, including some ready-made sushi and a hibachi grill area which was unattended (so much for that idea). While the sushi rolls looked good, they clearly had been sitting out awhile, as had all the food on the ""hot"" tables, when there was any left (it was clear that most of the trays hadn't been refilled that evening). Overall, one star for nice people, but sadly we won't be seeing them again, as one bout of food poisoning was enough."
768,Cold hash browns. This McDonald's ALWAYS has cold hash browns. And the service is by far the worst of all the McDonald's restaurants I've visited in my lifetime. I've given this particular McDonald's several chances to redeem themselves and they've managed to fail every time.
769,"Online the branch closes at 11pm. At 9:45 pm we were waiting in line at the drive through and by 9:55 pm we finally get to the drive through mic. We wait for 5 min then someone responded, ""we are closed. Just started cleaning."" Mentioned online says they close at 11pm. No response. There was a line of 8 cars waiting and people in the lobby. Figure it out."
770,"Filthiest restaurant I have EVER seen! Not a clean table in the house, broken urinal & fecal matter all over the toilet. Waited almost 15 minutes for a cold big mac on a stale bun. Never again! Only 3 customers in the store with a large staff"
771,"This location just needs to be SHUT DOWN!! It's freaking horrible!!
1. It says it's open 24/7 LIES! 
2. Slow as hell, inside and drive threw. 
3. It's disgusting inside!! It's NEVER CLEAN!!
4. live in the neighborhood and I swear since the mcflurrys came out their machine has been ""down"" BULL!! 
The employees are just lazy and rude! Get your shit together McDonald's!!!"
772,"Horrible service! Fries were cold, and hamburgers were extremely  sloppy and not organzied. I wish I would be able too give a negative star for the ratings. I would not recommend this place to anyone. They want a $15.00 an hour for their service. This is ridiculous, get it together people!"
773,"I usually don't write bad reviews but this really is the worst McDonald's I've ever been to. We lived by this one for 3 years and every single time was a pain. Either they are out of soda, can't accept cards, never come on the intercom to take your order, take 20+ minutes when there are only two cars in the line, etc. The list goes on and on; it's almost laughable how terrible this place its. The owner, if this is a franchise, should be ashamed. If this is a corporate McDonald's, fire every single manager. Other McDonalds around the area are all great - but this one is legitimately terrible."
774,"Just a complete waste of time. No professionalism and by far the worst McDonald's I've ever been. I waited nearly 15 minutes in the drive thru just for 3 other cars to go ahead of me. After I repeatedly said ""hello"" and ""is anyone there"" with no answer. I just drove off at that point (fire your drive thru cashier please). Unfortunately this one is very close to my house and it being late (10:15pm I had no choice but to come here). I am taking my business to the McDonald's on waters ave and Armenia. Where I just had my order taken, paid and given in less than 10 minutes with a line full of cars. AVOID THIS PLACE AT ALL TIMES!"
775,"Honestly if I could give this Pizza Hut location a negative 5 star rating I would. I called and placed an order for carry out and was told it would be ready in 20 minutes. Cool. Went to pick it up and they had no record of me ever ordering a pizza.

They told me that my call had likely been sent to the call center and the call center had most likely sent my pizza to a different location. I called the call center and they have no record of my order either.

The fact is, I recognized the voice of the guy working the counter when I went in. I have no doubt that he ""took"" the order. When I got to be visibly frustrated he told me it was his 2nd day on the job.

Finally I placed another order that was supposed to be ready in 10 minutes. 20 minutes later I had a pizza and some cheese bread I didn't order (I ordered cheese sticks)...

This is the most worthless place. If you work here, do your future a favor and quit. I swear to God this place is like the Twilight Zone. I worried for a moment that I'd walk out the door as I exited with my soggy pizza and unloved, unwanted cheese bread only to find myself in some endless Mobius Strip time loop of Groundhog Day-esque proportions. 

But hey, if you're in the mood for wasting your time and feeling like you've begun to dangerously sprint towards the edge of sanity, then call them up and order your disgusting lipids. Bring the family and ruin their day as well!"
776,If I could give zero stars I would. My steak was completely raw when it came out. My fries were also cold. My daughters meal was cold as well. My steak came back out a half hour later and I was told it was reheated. The prices are way too high for cold gross steak. Half the table never even got food. It took an hour to even order. The manager was rude and treated us bad when we complained about the gross food and horrible service. Don't waste your whole night like I did and still didn't get a dinner.
777,Not at all happy with my delivery order. I received my order on a timely matter but probably because half of my toppings and cheese we're on one side of the pizza and box. Beyond pissed and I left a decent tip to open up both of my boxes of Slop!
778,I'd rate this 0 starts if I could. Recently visited and placed order in drive through. 5 PM on a Sunday. Took over 40 minutes. 40 minutes at a fast food restaurant. Finally got to the window handed the wrong meal. No apology for the wait. Pull out and see nobody in the restaurant but 4 employees standing around. Unbelievable. Whoever owns this should be ashamed and will be sharing with McDonalds HQ.
779,"Would give this place negative stars if I could.  Drive through, even if there is just 2 cars infront of you will be a 30 minute wait.

Soda and icecream machines have been down multiple times

Food is always cold and stale."
780,They decide when they want to deliver and to where.  We live right across the street from them and they told us they didn't deliver to our location and gave us a bogus number to call.  We call back and they put us on hold.  Now I would eat the pizza because I'm scared they would do something nasty to it!  The girl taking the order is to inexperienced!  This place is horrible and I would never refer anyone there.
781,This is the absolute worse place to eat! The food came out cold after we waited over an hour to get it...i asked the manager what was the problem and she was a total bitch to us! She took 2 table orders at the same time and mixed up all the food!! I wouldn't give a bum there food to eat!!!!!!
782,"This is the slowest mcdonalds on the planet! Waited close to 20 minutes just for 2 breakfast sandwiches. Even whenever we got to the window, they still didn't have our order ready!"
783,McDonald's sucks I ordered a milkshake and got a one with green on the bottom and no cherry they always had cherries Idk what happened but they need to change that don't get a milkshake from McDonald's
784,"I've been there 2 separate times -once at 9:30pm and another at 10:15pm - and NOBODY was ever at the drive thru! Hours are until 11pm as far as I can find. One time I waited 5 minutes, said ""hello?"" a few times and nothing. Not sure what's up but definitely crappy service...if you're busy just let the customers know."
785,"I was gonna give them 5 stars except for one little incident. I ordered my pizza around 10 pm. I couldn't have been more tired or hungry. I fell asleep waiting on my pizza but I don't think it took that long, only took 2 hours to deliver it. The guy who delivered my pizza woke me up and honestly I didn't even remember ordering anything. I even asked him if he was sure that it was my pizza. I tipped him $1 and I think because of that, the pizza tasted horrible. That was the worst pizza I've ever had! I threw it outside and on my way to work the next morning I saw at least 10 rats laying on their back flat dead. It didn't take me long to realize that was the result of them eating the pizza I had thrown out. Anyways, I want to thank Pizza Hut for helping the neighborhood get rid of this many rats at once, way to go!"
786,Absolutely disgusting undercooked burger after ordering plain. So gross. I will not go back. This could have caused some serious food poisoning.
787,"This place looked very promising but quickly turned into disaster. The buffet was lacking variety and food. it seemed to take them a long time to replenish. The desserts were meh what could go wrong with frozen cakes?? RIGHT.With all this I could have gotten past (maybe) but my disaster was the service. The waitress never came back we had to hail her every time she brought a large glass of sprite for my granddaughter (who is 3) without a lid so I ask if she could put it in a child cup no problem. Then about 15min later I ask her for the drink ""oh yeah, I will be right back"" another 10 mins I ask again and finally got her drink yes she took the original drink back. My husband ask for a refill 3 times and never got it. Needless to say we left a note on the bill saying ""we tip according to service and since we didn't get any neither do you."" THIS is a FIRST for us we always tip and well."
788,I have eaten here before and it's always decent but I ordered two medium two topping pizzas that were a special and both have barely any sauce on them. The cheese was very salty too. I couldn't even finish the pizza I got for myself. Not only did they talk crap about me and my request when I came back for a refund but Lisa tried to tell me we ate 1/2 of each pizza when we had each eaten a slice and tried to eat a second and just couldn't stomach it. They were all incredibly rude except for James Bagsby. I will NEVER eat here again!
789,"I placed a mobile order for two breakfast sandwiches, and arrived at the drive-thru at 6:17 am (Saturday). The employee informed me that she was still preparing to open and it would be another 15 minutes. While I waited, about four other drivers were told the same. At 6:33, she told me again it would be 15 minutes; I continued to wait in my car at the speaker. 3 or 4 other cars were subsequently told 15 minutes at the second speaker. At 6:51 a customer at the second speaker placed an order and drove to window one to complete his order. After two minutes of silence, I drove to window one, the same employee asked me if I had already ordered. I began with yes, and continued to explain that I had been one of the earlier customers waiting, when she eagerly interjected to explain that ""this is window one...that's window two...you need to drive up to pick up your food"".

I drove to window two, knowing I would need to explain to someone else. When I arrived there and began to let the second person know, I began to hear the original employee yell from the rear of the restaurant ""...well, he didn't tell me he had a mobile order...he should have said something"". She then walked up to the window and said they had no record of my mobile order (FK55), and asked me if I still wanted the items. I commented that I would prefer not to have to pay twice, and she informed me that ""you will have to contact the credit card company to get the first refund"".  I was generous with my time, and apparently with my money. The employee was neither courteous nor helpful. I drove to the Hanley McDonald's location, where they were a bit backed up due to construction, but prepared my order rather quickly, and were considerably kind in asking me if I had everything I needed. 

Hampton Avenue McDonald's continues to be a poor customer service experience for me."
790,I have never seen such long slow line for drive thru. Tired of waiting went in for coffee had $10 and a $1 came to 1.10. Daughter had left change in car.  Rather than breaking a 10 the employee. Said I will wait for you to go get a dime from your car.  I think I'll pass on this McDonald's
791,"First time going to try Granny's Buffet and I will never go back. I always try to go to mom and pop stores/restaurants to try to help and give back to the community so we figured we would try them out.
It was Terrible! I was shocked at how we had to pay before we even sat down, and even worse they wanted to know if I wanted to put my tip on my card then. How do I know if I want to tip them if I haven't even sat down yet? Then she made a huge deal about what soda we wanted and we had to decide then as well. Once I get to my table I realize she made a huge deal about what I wanted to drink, but didn't give me a drink. Only for my waitress to come over to take my drink order. Really??
It smelt like old food and reminded me of a nursing home. Once we got up to go and get food, I couldn't decide what I wanted because none of it looked appetizing to me. I picked some baked chicken and french fries, only to find out once I sat down the chicken was dripping with fat and oil and my fries were soggy and cold.
After my first small plate of food I just decided to skip trying to eat anything else and would just go right to dessert. I went to get ice cream and the ice cream scoop was sitting in old dirty water, i found a napkin and tried to clean it off the best I could before using it. Then the hard part was deciding what ice cream to pick because there were so many empty containers and half of the full ones had other ice creams mixed in with them and toppings from the topping bar in them. GROSS!
Myself and my sister were so grossed out and disappointed by our trip there that we will never return and I will never recommend Granny's to anyone.
Also they should update the decor from the Chinese restaurant that was there before them."
792,"If I could give no stars I would. One employee wanted to throw down over an iced coffee mistake. Asked for ""back iced coffee"" and first received a coffee with sugar and milk, then received a coffee with sugar. She yelled at my sister over it. You could see the pumps of sweetener distinctively separate from the coffee... mind you, we waited 20 mins for four breakfast sandwiches while workers stood around doing nothing. Will avoid this store."
793,"Worst McDonald's I've ever been to. Do Not Go Here! Wish I could give 0 stars or even negative. Looks nice on the outside and good area. But crappy service, takes forever, people are rude. This is the only time I have ever written a review in my life. I usually think it's a waste of time but I had to say don't ever go here"
794,Please please please do better. The location is fire but for some reason this place sucks. Literally have tried over and over and never once have I gotten good service or good food. How is that even possible?
795,They have a 11 year old working the register. I waited in line for over 15 minutes after paying for my order. They then flagged down the 11 year old so I couldn't get my order corrected. The management here is ridiculous. How hard is it to serve a burger and fries? I guess very hard when you're 11 years old...
796,Not real sure why they're open. They have no Co2 so no fountain drinks. No sweet tea. No salads. The cashier is incredibly friendly but I had to wait to place my order while she went and got change for the customer in front of me because she had no one. And I have been waiting for 15 minutes to pick up my food. There is zero organization or leadership apparent and I would have gotten a refund a left but it's not worth disappointing the kids and wasting more time going somewhere else.
797,Supposed to be open 24/7 but they just told me they were closed after serving the car in front of me.
798,"This McDonald's has one thing going for them: consistency. They are consistently terrible. I've never been one to review fast food, but it's actually amazing how bad every visit has been to this place. It's the closest one to where I live, so it's disappointing that it's actually the worst location I've ever experienced in my life. Drive thru takes at least 15-20 mins on a slow day (don't bother during lunch). Not only slow, but rude service every time. Very troubling that this is located near such a busy intersection, but I will now travel out of my way for McDonald's just to avoid this mess."
799,Stopped on our way home from a Blues game. We were informed they wouldn't be able to take any orders for at least 15 minutes because they were in the middle of a shift change. Seriously?
800,Consistently closed WAY earlier than posted hours. Honestly not going to even check anymore.
801,This is the worst McDonald's I've ever had the miss fortune of coming too. The staff are consistently rude and are not interested in doing anything to help anyone and I've never seen management act as lackadaisical this management does.  Furthermore they routinely close 15-20 minutes before the advertised time and don't care.  Avoid this one and go to Hanley Road where you'll have a chance!
802,Came here at 12:30 AM on 11/24 and I have never had worse service from a place anywhere in my life. the lady in the drive thru was exceedingly rude when I was just asking questions about the menu. I see why this place has as low of stars as it does. Do better.
803,"Another one star review. What a surprise.

I don't know how many times we've been here, maybe about 6 or 7 times. 

Each and every time we've had shitty service and bad food. I don't think I've ever had fresh french fries there. Each and every time they've been soggy. If I had to hesitate a guess it would be that they scoop the fries that are getting older out of the bin into the containers and putting them aside before they dump the new batch in that then sits there until the old, packed containers go out, repeat. 

Same thing with the burgers. I'm not making it up, half the time I've been there I've had dry, stale burgers buns, twice to the point where they were inedible. I mean hard and stale. I don't know what's so difficult about pulling buns out of package, processing them, making burgers, and sending them across the chute. 

Then! To top it off, you can't order anything special order. It just gets messed up. ""McDouble, no ketchup, no mustard, add lettuce."" That's it. Never have they gotten that correct. 

Lastly, I go there normally around peak time. So it's not 1/2 before they close, it's not dead of the afternoon when they hardly have any drive-thrus going through. 

There's a reason for the lack of cars at the drive thru. There's a reason this location pretty much only gets one star from everybody.

Just pick another location."
804,It's nasty. Nothing I got form the jerk chicken to Mac and cheese to yams was cooked right.Doesn't even taste like Jamaican food. It's honestly so bad it should be a crime and they need to shut down and do some cooking training but I'll settle for this review where I tell you never to order from here because if you've eaten Jamaican food from anywhere else you will be disgusted.
805,"Literally the worst. 5 cars in front of me and waited 40 minutes to get my food. I would have easily backed out if I could have. No one at the cash window to pay, so I had to wait for someone to show up. Orders are cold and wrong. Don't come here."
806,"I have not written a lot of yelp reviews, but I felt as if I owed it to the world to take time out of my day to write this. How in God's name is your ice cream machine being cleaned during shamrock shake season? How does it take 8 minutes in the drive through to provide luke warm soggy fries? Ronald McDonald would be ashamed, and the employees should be too."
807,"Order was placed at 12:57, and was due to arrive at 1:40. At 1:54 I called to check on it, and was told we were next up and about 10 - 15 minutes. 30 minutes later I called again, and was given the excuse only 1 delivery guy. The ""mngr"" kept interrupting, not letting me speak, and when I asked her what time she received my order, she said 1:13. I kept asking why she didn't let the customer know then it was going to be late, and she never would give me an answer. When asked for her managers name, number and email, she refused to give it to me. I canceled my order at 2:33, almost an hour after our order was supposed to arrive. POOR CUSTOMER SERVICE!!!"
808,"This McDonald's is utterly terrible with its bad customer service, terrible management, and has messed up my order too many times to count. I would not recommend ever coming to this establishment, even with the better interior decorations and seating arrangement. The staff is always arguing and they are not cooperative to get my order correct when I notify them a mistake has occurred. The manager has an attitude with customers who try to gain his attention. He was even screaming at an employee while I was waiting for my food to be completed. I wish some improvements would be made before this establishment closes due to poor management and training."
809,couldn't even get our all of our order. also the lady that bright it out to us was very rude. Also the orange juice was warm. Very very very slow!
810,"Multiple times ""closing"" before their hours, turning off their lights with me in the drive thru just now. Forgetting to turn off their headsets and talking abut customers. I know it's just mcdonalds, but come on guys."
