,Reviews
513,Says the drive thru closes at 2am multiple times coming here no later than 1:45am to no service.
514,WTF Jimmy Johns??  No lunch for me today.  Would like to give to zero stars.  I ordered a couple of subs and after over 45 mins they hadn't arrived.  My lunch break was over so I called to cancel.  The person who answered the phone told me the manager had stepped out and would call me back for a refund.  They never called back.  Maybe if the manager was at work they could get orders out on time.  They're Freaky Slow and Freaky don't care if you ever get your food.
515,"Just left this place we sat in drive through for over 30 mins, I ordered 2 double steak burgers with fries one with no tomatoes, on one after my long wait my burgers were absolutely disgusting very old cold hard one had only cheese the other one had cheese and one onion The bacon was burnt, the fries were really old hard and cold the order was someone else's order that didn't want it!!! I called to talk with the manager Shay.  She told me to hold on she was with a customer, I told her I was a customer as well, she said what do you want a refund new food or what?? I said please listen to me, she said hold on then hung up on me, I called back the phone rang and rang she never answered I went back the manager started going off on me as if I was in the wrong!! She has a awful attitude and is very rude, the quality of the food and service is the worst I've ever received!! This is my second horrible experience at this place the only reason I stopped there, is my teenagers wanted it!! The manager didn't give me my receipt back, she walked away and never came back to the window!! The young employees were going in and out of the door with their aprons on!! That's not sanitary safe or clean!!! The floor from the drive through window was disgusting their uniforms were dirty one girl had on Nike slides with very very long false nails!! This place needs new management and new employees!!"
516,"10/3/18 10:30 pm.  Just the worst place we have ever stop at!  the manager was a complete ass to me my wife and two kids.  Not only did he tell us half the menu was not available he proceed to tell us  he didn't give a ""fuck"". They we were unhappy 
No looking for free anything but base onthw review of this store you guy need to rap- i. 
Glideinvestments @gmail.com"
517,Worst ever...last time my family and i will visit that KFC. Last three times we have ordered from there and the place wasn't busy...orders all jacked up. NEVER AGAIN
518,"Two different trips to this location. Both being the worst experience I've ever had at any restaurant ever. Inside I was ignored for over an hour and the second trip I took the drive through as it was impossible to park and also I figured they couldn't ignore me if I was in the drive through. They did. They told me to look at the menu while waiting on them after I waited half an hour in the drive through line to even get that far. Then they refused to give me the order because it was an online order and I have to go inside for that. It was impossible to park and I just waited half an hour and it would really be that hard to hand an already made box of food through a window? No other location is like this. No other location has that rule. Nevermind that I didn't want to go inside at all because of the current health crisis. They not only lack concern for their customers, they seem to wish harm upon them."
519,"This is the worst place to go unless you're willing to wait 30-40 minutes in drive thru line and love having to go back after they mess up you're meal. I live in the sun valley area so I've been to this location a few times, in which every single time I go I'm waiting several minutes for them to even take my order. Something needs to be done about this location, hire new people or something but it's trash if you ask me."
520,I walked up after someone had just left in the lobby.  They never even acknowledge me for at least 3 to 5 minutes. Absolutely the worst service I have ever had.
521,This location is horrible and today was my last attempt.. Got there at 12:45 sat at the drive thru but no one answered. Drive around and park to go in.. Open the unlocked door to see NO CHICKEN ANYWHERE...but why you ask? I hear someone yelling at me that they are not open yet!!!!! So they would've just let me sick at the drive thru had I not gone in... The whole crew needs to be thrown away...
522,"This is likely the worse fast food place in Tucson. I ordered two fill up boxes. They said a 6 minute wait on biscuits. I happily understood and pulled up front. They said they would bring out the biscuits. After a 20 minute wait, I still received no biscuits. Stay away from this place."
523,Food was cold I don't even understand how but yes it was cold and when I approached them about my food being cold they just shrugged it off like it wasn't a big deal I try to stay clear of fast food placed but since today payday I decided to treat myself definitely won't be coming back I wish I could give them 0 stars.
524,the owner doesnt know the difference between fake money and real money ! i went in the store to get change for $100 bill and one of the twenty dollars was fake i realized once  i got in the car and when i went back in to get my bill back he called the cops and they didnt do anything about it ! so when you go and they give you bills check and make sure its real i will no longer be doing any business there !!
525,"I'll start by saying that we love Steak 'n Shake; but this location is just horrific.  My family has been coming here off and on for over 20 years.  Each time we come, we say that we'll never come again -- I guess we're masochists, because we eventually come back and have the same experience.  It's a filthy place, your shoes stick to the floor, everything is gross -- I feel like I need a shower when I leave the place."
526,"Showed up at 8:35 but the door was locked and the employee inside gestured that they were closed, even though the posted closing time was 9pm. Went across the street for some delicious Greek food instead that actually closed when it was supposed to."
527,"So this is the worst thing ever.I hate this place because the biscuits were not cooked. The chicken was dry, trash all over the place and the dustbin was leaking and no one cared. Never going back here"
528,"I ordered a dine-in dinner.  I asked for salt.  Christopher, the manager, said they were out of salt.  I said they should have a sign up informing customers they have no salt.  Christopher was copying numbers onto a sheet.  I said, ""Bag up my dinner.  I will take it with me.""  He kept copying numbers.  I said, ""I am an unhappy customer.  Bag up my dinner.  I am your first priority.""  He said, ""No.  My first priority is money.  You have to wait."""
529,Only rated this place 1 star because that's the lowest it'll go. Food is always cold; staff has no clue what they are doing. Wouldn't survive a day when they were actually busy. Easily the worst Wendy's you can go to. Save yourself the money and the time and go somewhere else.
530,"False Advertisement, the Asian Chicken Sucks, just watch the commercial & droll, because they're just old chicken nuggets thrown in some sweet hot sauce, i could have coughed up something better from earlier taste testing @ the Mall's food court"
531,"Doing a delivery, stood by pickup and wasn't even acknowledged for 20 minutes, so I sat down and someone who wasn't even delivering stood there and still wasn't acknowledged. Nobody in the place gas their food, looking at the reviews the quality of the food is terrible (hopefully that doesn't reflect badly on me) and I can't imagine ever having a good experience at KFC. I've never eaten there when the old wasn't like 6 weeks old. A woman's food was left at the pickup window without even calling out what it was or who it was for and it was only because she overheard the cashier's saying it was for some lady and her kid that she even got her cold food at all. Finally got acknowledged at the thirty minute point, guess it's their policy to ignore people who've already spent the money and focus on the ones who still need to sink their cash into the shit hole. God I wish they could make food well because I love chicken much more than burgers. Every KFC I've been to has bad food, this one also has long waits and poor customer service."
532,The service is not so great and the establishment is not very clean sometimes forget your order but the food is great
533,"2 minutes ago

Would give zero stars if an option. Ordered a 5 piece wings through the drive through and was told it would be a 12 minute wait. She told me to pull on the outside of the restaurant and they would give them to me free since the wait was long. After waiting 20 minutes I was told by an employee, that was bringing food to someone else outside waiting, mine was coming out. I waited another 10 minutes before going into the restaurant. After waiting politely to speak to someone I was told by an employee the grease hasn't been turned on for the wings and the were just putting them in, it would be another 17 minutes. I refused to wait that long and told them I already had $45 worth of food getting cold in my truck from the restaurant next door. I thought it would be an easy in and out to get wings for my son but nope. I asked to speak with the manager and she wouldn't even speak to me, she just gave me a dirty look like ""what are you still here for""! I will never give my business to them again. Don't waste your time or money at this place bc it ain't worth the stress."
534,"I was lazy and stopped into the KFC 7245 East Golf links Rd here in Tucson. I made my order and went to the window. The guy said the reader is messed up from dropping all the time. Then he showed me the  register tape showing my card was declined. I let him know that nothing was wrong with my card and he handed me a slip saying it was declined. Now thinking what he had said at the start about the reader. I thought he would be smart and use one of the other registers. Nope the money he makes per hour! Not enough to get him to walk that 10 foot stretch. Before I left the lot I called my bank and they said nothing wrong with your card. I went to Popeyes bought our food there. With the same card!
Lesson to learn! Don't wast your time at KFC."
535,i think someone had a severe diarrhea because they didn't cook the damn chicken right lol
536,"I've never written a Yelp review but this situation deemed worthy of one. I've been to this location twice and I've ordered the KFC bowl which is supposed to be made with popcorn chicken. Both times were a fail. The first time I went there was about 3 months ago, I ordered the KFC bowl and when I got home I realized that there was no fried chicken in the bowl let alone popcorn chicken. It was greasy shredded chicken thigh. They also had me pull into a parking space and wait 10 minutes for the ""fried chicken""....when they didn't even make it with fried chicken. I was annoyed but blew it off as a fluke. Tonight I went through the drive thru and ordered a KFC bowl again. This time they STILL didnt make it with popcorn chicken but instead made it with chicken strips that were just ripped up (again having me pull into the parking lot and wait 5 or so minutes) Apparently they were out of lids for the KFC bowls and they wrapped it up in plastic wrap, making a giant mess of gravy everywhere. They forgot to give us our mac and cheese that we had ordered as well. When we called to see how we could resolve this, they didn't sound apologetic but instead sounded irritated with us. They did however agree to give us our mac and cheese if we came back. I decided to drive back and get the mac and cheese. When I got there, I spoke with who I can only imagine was the manager on duty. I explained to her that both times I've gone there, I had ordered the KFC bowl specifically for the popcorn chicken and neither time did it come with that. When I asked how we could ensure that we get the popcorn chicken with our meal next time, she firmly told me that ""they only had ONE deep fryer that they were working off of and I would have had to wait 20 minutes."" First off....no. I've worked in fast food before and it doesn't take 20 minutes to deep fry chicken. Secondly, there were no other customers there! So what on earth was taking so long? Third and finally, I've been a manager at many different establishments and if that was actually the case, the manager should have told us that the popcorn chicken was going to take a long time to cook and should've given us the option of waiting ""20 minutes"" or asked if we wanted different chicken. Instead, I got attitude from someone who didn't want to ensure her customers' satisfaction. I got no apology and no compensation. Even when I asked if I should call ahead next time if I wanted popcorn chicken, she told me that it takes too long so they just do this instead because she ""didn't think I wanted to wait 20 minutes"". Sooooo I guess this location just doesn't serve popcorn chicken guys. Sorry, you are shit out of luck. Because it takes TOO long. Because they are just TOO busy. Oh yeah.. did I mention that 3 hours before their closing time they had the OPEN sign shut off and all the chairs were upside-down on the tables? I'm pretty sure these KFC employees were trying their best to make the public believe that they were closed so they could get out of there and spend their hard earned minimum wage paychecks on cheap booze and hookers. Ok, that last part was mean (funny...but mean) and I'm sure they aren't spending their money on hookers. But I'm just annoyed and if this situation had been handled with any integrity at all on their part then I wouldn't be spending my night writing this review. I'm not a complainer and I'm a pretty easy going person. I don't expect orders to be perfect or even correct every time. We're all human and we all make mistakes. But laziness and sheer negligence can either make or break a business. Instead of fighting me on how long popcorn chicken takes to cook, a simple apology and maybe offering me some free dessert or something would have sufficed. I don't know these people personally and this is not a petty attack on their character as individuals. But if you want your business to thrive and your customers to come back with smiles, just be sure to give them what they order. If you can't do that, be sure to make that clear to them and offer them sincerity and some compensation. As for me, I'll not be returning to this location. I think I'm going to get into the popcorn chicken industry and make the best goddamn chicken you've ever tasted.....And I promise it won't take 20 minutes ;)"
537,I wish I could give this place 0 stars. DO NOT spend your money here. Food is trash and the staff is extremely rude. My brother got cursed out by an employee b/c his total was $11 and the minimum for delivery is $15.
538,"No words really, just walk in. Dirty.
Also out of cheese, I mean what?
Don't waste your time. We didn't even stay."
539,Worst McDonald's in the world honestly. If you want to wait 15-20 minutes minimum only to get your food and it's cold this is the place for you haha. Tried giving them another chance and I was waiting in drive thru for almost 10 minutes again and hadn't paid yet so since no one was behind me I backed out and left and will never come back. Have fun with the extra food dorks.
540,Sold me a completely raw chicken sandwich. Found out when i bit in to it. Always mess up orders at this location. Super long drive thru times. Terrible management
541,"I witnessed that loud, rude, extremely unprofessional manager person yelling at the real estate people next door.  Someone was double parked. I was parking. He was yelling and cursing that he was calling the police. The folks next door came out to see what was going on. They told him it was a client of theirs and they would move the car. They said sorry.  The pizza hut guy went off. He called the police and yelled and cursed at them.  The parking lot in this place is a freaking nightmare.  All he had to do was say ok and go back in his store.  He was yelling and threatening.  I won't be eating here again.  And they aren't wearing hair nets, they are loud and only the delivery girl has some sense...jesus."
542,"If do really wish one could put a zero star rating. 
An ill neighbor want KFC, so he gave me his cash and I went for him. I had to travel 10 miles to the store, whereas, there were other chicken store much closer. I waited in the drive up line for almost 15 minuets, then made it to the ordering speaker, only to be told, "" We are only accepting credit and debit cards...""No cash.""
""Really?"" I said from my car. ""You mean, I waited 15 minutes in line, only to be told I can't order because I have cash.""
""Yes."" she said.
I had to pull out of line, and drive back 10 miles, to a close chicken place...Church's Chicken, which he was just as pleased with.
If they were in that situation, shouldn't they have posted a sign letting all drivers know they weren't accepting cash because of (their Covid procedure)?

Like I said ZERO star rating."
543,This location is HORRIBLE!!! I have had problems here multiple times. Even had to contact district manager who obviously can not get this place the management they need BECAUSE THEY STILL MONTHS LATER DO NOT HAVE IT TOGETHER! On the last trip We ordered four meals. We waited forever at the window. Once handed our stuff we realized she never gave us two of our drinks. Had to knock on window and then basically argue about how she owed us sodas. Had to ask for straws. Asked for ketchup and she gave me four packs. What am I gonna do with four packs for four meals. So had to ask for more. Mind you the whole time she acting like we are bothering her. Later hubby said she was texting and I had interrupted her when I knocked on window. Once We got home our stuff still wasn't right. Two outta four meals completely wrong. Then when I called I was told to come back the next day so I did. However the person I talked to wasn't there and she didn't leave a message or note for the person who was. So I wasted my gas and time going up there. The next day when I called the person I spoke too was there but now said she couldn't do anything because even tho she remembered our conversation and remembered writing my name and number down she coudknt find it and I didn't have my receipt (she didn't tell me I needed) there was nothing she could do!!!! This was the last straw Seriously I don't think we will ever be going back to this location!
544,Been here twice. Once we got a raw pizza. The dough was like pudding inside. Another time we just never got our order delivered. No answer on the store phone.
545,"This place is horrible.  It's definitely the slowest fast food place in town.  I've gone there once, maybe twice successfully as a delivery driver.  Tonight marked the fourth visit in a row in which I drove over there to pick up an order and had to leave 20 minutes later with no food, abandon the order, and drive off knowing I wasted half an hour trying to pick up chicken from a chicken place that just couldn't get organized enough to actually give up some of their chicken in a sale.  The people working there tonight never once greeted me or acknowledged my presence upon entering, delivery bag in hand.  I went in, waited in the lobby for five minutes, and I was completely ignored.  I went back to the car and considered my options.  I tried calling the restaurant from the parking lot, but of course they have hidden their phone number on Google from the public like shifty degenerates trying to avoid being served a notice.  I went back in and waited another ten minutes in the lobby.  Still I was completely ignored.  And that's why you had to wait forever for your dinner;  you know who you are."
546,Messy food not made how we ordered kids meal had no yogurt iced coffee horrible and bitter
547,Gave myself my boyfriend and my best friend food poisoning!!! Do not go here!!! They shouldn't be aloud to serve food it's messed up how many people have complained and are still getting food poisoning.
548,Never going back.Either they mess up your order or they never send it and take your money
549,Do not order for pick up online! That wait until you get there to make your order! Then get it wrong. It looked like they were doing a good job in drive-thru.
550,"I honestly wouldn't even give this place a participation trophy. We came to the drive thru and ordered a $30 family fill up. The lady on the mic sounded annoyed while taking our order. We pulled up, paid, and were told to go park in front of the restaurant. Under 2 minutes had passed when an employee came out, confirmed our order, and had us on our way with our order in hand. When we returned home, we realized the gravy from the order was missing. However, my biggest problem I had with the order was one of the eight pieces of fried ""chicken"" was basically a breaded and fried bone. The chicken must have been on a hunger strike before the colonel sent him to the cage free chicken farm in the sky. I crushed the piece with my fingers and came to find there wasn't even any meat on the bone. See pictures. I firmly believe this wasn't a simple lack of attention to detail, as it was pretty obvious that this piece was made with no love......just remnants of the chicken's bitter hate and anguish. I don't know if the lady taking my order wanted to make sure my visit was terrible or a server shrugged and thought I wouldn't notice. They won't notice one less customer *shrug*."
551,"I reviewed this kfc about 10 months and it seems as though nothing has changed. I went back to this kfc, because I absolutely love your Mac and cheese, I once again was met with a worker telling me they won't have any for another hour. At 7:30 at night are you kidding me. It seems as though this location has no management at night. It's like a bunch of teenagers have taken over that place and don't have a single care in the world. They always seem to be out of something, like the Sierra mist they were out of last night, or that not enough food was prepared in time. The lack of organization that came from Ashely the drive thru woman and her co workers was abhorrent. I would love nothing more than to give this place money all the time but I won't because it's never a good experience I've gone here about 4 times always bad. Please step up your game it's horrible to see such a loved place be so bad."
552,Who hired these clowns? Worst service I've ever received. I have a stutter and they told me to just leave because I mess up on a word 3 times.
553,"Since there is a limited amount of KFCs, do to locations closing permanently, I made my way all the way down from the SW side of town to Golflinks/Kolb for family meal. 

As expected the line was long (it is the weekend after all) and we waited. The the drive thru cashier (Keyla) was cutting us off as the ordered with an extremely annoyed and bothered tone. She rushed us and as we approached the window, she was still giving a negative and rude attitude. She handed the food upset after we asked her for a receipt. 

I'm not one to complain when I see tired and exhausted ppl attending me at a fast food restaurant. However, I was very I pleased with the customer service delivered. I will not be returning and I hope this fast food ""professional"" receives some type of discipline and training. 

All I hope is that their word stays true to what they state their commitment is: 
""We are committed to using our voice to speak up but more importantly, using this time to LISTEN, LEARN, and act to CREATE POSITIVE SOCIAL CHANGE. We have to do more. We will do more."""
554,2 mistakes in a row w my order. One employee not wearing mask at all. 2 others weren't covering their nose.  A real sh** show.
555,This particular location has terrible customer service. There seems to always be an issue. Today for example I go in and wait for my food I ordered online. I ordered a box of popcorn chicken and they tried to give me a small. When I corrected them and showed them the order on my phone they became rude and the manager was even rude. I work law enforcement all day dealing with rude people and people yelling at me. Don't need it from KFC workers. Never coming back and hopefully others start finding this out too.
556,Went to this location 3 times and each time they were incredibly slow. One car sat at the order speaker for 15 minutes. I see this as unacceptable. It's called fast food not slow food. I think they have the chickens out back and have to kill them and pluck them because they're so slow.
557,"I came here hours before close. The woman through the drive through speaker was incredibly rude with no patience. My boyfriend doesn't frequent here and she was rushing him as well as laughing at him. I have worked this whole pandemic, and a little
patience and kindness would be appreciated."
558,"This place is DISGUSTING! The manager was on meth (no lie). Two other customers were with me in line. We waited for over 30 minutes. They were making pizzas without gloves, wiping sweat off their forehead then back to making pizzas. DISGUSTING! One customer waited 45 minutes for 5 pizzas. Where is the district manager? Ridiculous!"
559,"Can I please give this place zero stars!?!!!
Walk into the place and they have trap music blasting thru the speakers with cuss words mind yourself I have a 4 year old with me. I walk to the counter and he doesn't acknowledge me I ask for a bread and he's slamming things. Doesn't proceed to even ask what kind of sandwich I wanted ....so I walked away. This place is in SERIOUS NEED of a corporate visit and new employees"
