,Reviews
266,"I just ordered 2 pepper steak platters  with mac and cheese collard greens for pick up when I got there to get the order first I was told they had no greens so i opted to have Mac and cheese and yams  the price for medium platter on their menu is $ 12.00 per platter on the T.V. in the restaurant even states that the platters are $12.00 (WRONG )
 I was charged $14.00 per platter  and then to make matters worst the platters was like we ordered a MAC and CHEESE platter cause they had a lot of that with no cheese and the pepper steak was like eating roast beef there were no peppers in it and the yams was entirely too sweet and then when my husband called the woman wanted to argue with him He told them it was like ordering a Mac and cheese platter with the steak and yams are the sides FALSE ADVERTISEMENT and the food is not worth the money they don't have a large selection of food for now on I will use my gas to go else where"
267,"I have lived in a Fishers for 20 years. During that time I visited the prior KFC in ""downtown"" Fishers. 11 out of 13 times, the food was poor quality, cold or otherwise inedible. Had a teenager who Loved KFC and thought it will be better next time. It never was. It was clear, KFC didn't care and I wasn't returning. It's been more than 6 years since. Tonight someone suggested we try the new one. I gave in reluctantly.

Went there and ordered the usual extra crispy chicken bucket. Got regular recipe - again. The slovenly dude at the window was unfriendly, curt, and could care less - typical management material of the past. Handed me a sticky credit card processing machine, then my food. Food was terrible. Wrong recipe. I can't eat the regular because it's too greasy (extra greasy tonight), and I had intestinal surgery years ago. Couldn't eat it. Chicken was warm, service cold, the crappy restaurant of the past is alive and well at this restaurant. I will never eat there again, neither will my guests and neither should you. KFC Fishers - expanding the definition of junk food!"
268,"Words of advice: Don't even think about eating here. 

Either it's broke, they don't have it, or they can't even take your order.  EVERY TIME."
269,More than likely if you go here you'll sit in line   Only to get up to the menu and they say we're closed . 3rd time I've gone and they always look open but half the time are actually closed . When I get lucky and they are ACTUALLY open . Food is always just meh
270,"MY ORDER: 
Fish and 2 chicken combo.
with drink.
RESULT: The idiot at the window said they had no more soft drinks left except Mt Dew and Diet Pepsi.  ORDERED Mt Dew
Also, told me no mac and cheese left, so my sides were the corn and mashed potatoes and gravy.  
Got home:  FISH, 2 Chickens were dark brown, so tough I couldn't bite through any of the 3 pieces. It'll be a miracle if I'm not food poisoned.  The corn was so cold I think it came directly from Freezer and they never even chucked it in the microwave.  The MT Dew was more like Club Soda, had no flavor just carbonated salt.  The Hushpuppies were hardened and a coloration I've literally never seen before.. I took one bite and had to spit it out.  
THIS PLACE IS NOT ONLY NOT RECOMMENDED, IT IS DANGEROUS TO EAT.. You'd be better off just picking something out of a dumpster.  
They stole $11 from me.  Never will go near this disgusting filth again. 
None of those kids working there care if you like the food or it kills you either.  STAY AWAY"
271,"This place food is nasty everyone in there is young and they rush with your order,, ordered chicken wings they were so salty and yo much breading, never ever again will I give this place my money."
272,You should know what you are in for when you order from a fast food restaurant.  I foolishly ordered a chicken sandwich.  I don't know what that frozen minced meat concoction was but it was not chicken.  I was literally sick after I ate it.  I will never eat at a Burger King again.  GROSS
273,"Went there on the 29th of July and order an eight-piece box - chicken only, no sides. When I got home I discovered that there were only six pieces in the box. What do you do? Go all the way back and tell them they only gave you six pieces instead of eight. Once you drive off the lot they can claim anything such as you removed them from the box just to get a couple of more. It wasn't worth my time to go all the way back in rush-hour traffic and chance a commotion being stirred up over two pieces of chicken. In the days of the pandemic, most restaurants are doing drive-thru only. Most people using the drive-thru will receive their order and move on so as not to hold up the line. This makes it easy for employees to rip off their customers, and I feel I was ripped off. And what made it worse was the price I paid...$16.38 for eight pieces of chicken and I only got six. Tell me I didn't get ripped off! I hope this message helps others. If you like KFC don't come to this one. Find another one!"
274,Came through the other morning for drive thru. Had 2 kids and a dog with me and was asked to come inside because they were short handed and didn't wanna do drive thru. Now today had to once again pull around and wait. Finally 10 min and food came out. Forgot my coke lady said she'll be right back. 12 min go by and still nothing. Now I have to get out and go inside with no shoes on. If you can't handle a drive thru don't have one. Needless to say there was only 1 guest inside and you wonder why the business has gone down
275,"Bad service and bad store..i order too much things ,and paid for money, but the store don't give me enough food , such as :no French fries,no large hot tea,no large  iced tea ,no 6 PC buttermilk crispy chicken tenders meal ,,I paid the money,but don't give me them,I am angry and unhappy!!I don't like the store !!!"
276,"Worst Taco Bell I have ever been to. Please do Alton a favor and shut down. This town will be better off without this business. 
It is 10:30 pm and we waited 20 minutes in line. There were 3 cars in front of us. I ordered a soft potato taco, a cheese wrap, and a tostado. I wanted to confirm the tostado didn't have meat in it and the worker was obviously annoyed because I couldn't hear her over the monitor. She repeated the order back and said ""soft taco"". I assumed she meant potato and was too afraid to ask because she was so rude. 
To much dismay I received a meat soft taco. What a disappointment. I know that Taco Bell will never do anything about this, but I hope this review will save someone in the future. 
DO NOT GO TO THIS TACO BELL!"
277,Every time I come to this McDonald's their shake machine never works there a sweet tea taste horrible and is very dirty inside around the drink machine most of the employees or rude
278,"This is a prime example of what happens to a business that lacks the proper management. So many issues with this particular location but the common theme here is the nighttime employee's. Time and time again they show the extreme lack of unprofessionalism. Now most of my dealings have been in the drive thru, but i have on occasion tried going inside. 

I say tried as a few times it has been around 8:00 and they have had the doors locked to not allow people inside. Also they don't normally turn on the outdoor parking lot lights so it never looks like it is even open. One time I had the pleasure of going inside to only be left unattended for a few minutes not even acknowledged at all. I ended up just leaving on this occasion. 

The drive thru is where most of my dealings happen. Most of the time you get greeted by an unfriendly voice that gives off the ""I want to be everywhere else but here"" attitude. Its just the lack of professionalism that really gets to me. From unfriendly greetings, to cussing and flirting with other employees, this is what you have to look forward too by visiting this place. Sometimes you get order correct and sometimes you don't. Just be warned, you are not their top priority when you visit this location."
279,"April 22, 2019. Gave this place another try. Ordered 8 piece chicken. They asked if ok that they had no legs, which we wanted. Then they came back and said never mind. We pulled up to the window and inquired about the chicken legs. They said all is good. We get home, no chicken legs. They are just awful there. Rolls were hard as hockey pucks. 

Prior review. Stopped by to order an 8 piece original dark meat and they had no original chicken ready. Would be a 16 minute wait. Really?"
280,"We ordered a shamrock shake and a chocolate shake. When we pulled up to the first window to pay, the employee very rudely informed us that they couldn't make the shamrock shake because the machine was not working so we settled for another chocolate shake. After sitting in line for thirty minutes we received melted shakes and of course requested new ones that were not melted. The employee snatched the shakes back and slammed the window. After waiting another five minutes, he came back and pushed the shakes into my hands and slammed the window again. We received no apologies for the wait or the melted shakes."
281,"Absolutely Horrible! I used Grub Hub. My food was late and cold. Nothing worse than throwing your hard earned money away on crappy food and service. Food was cold, cheesecake was frozen. I highly recommend not eating here!!!   Rating negative 5 stars!"
282,"As pointed out already, this location is horrible with deliveries. Yesterday I placed an order at 11 am for a 6pm delivery. The pizza was inspected at 5:45 and just sat there. I called at 6:30 to see what was going on and they told me it would be 2-3 more hours. Half the time I order pizza from this location I just end up canceling the order because of the delivery issues."
283,"******zero stars*****
 this is the worst brick oven pizza i have ever tasted.  salt was used as a main ingredient.  do not buy anything! disgusting!  vegetable pizza was thrown away by everyone of my super bowl guest.  this business needs to be sold to someone who knows how to prepare food, period!"
284,We moved to Alton less than a year ago and tried this taco bell several times now and each and every time they screwed something up not to mention how filthy the inside is! They must have the most uneducated morons in town working there..from management on down..I truly believe being stupid s a requirement to get a job there. Every single time they screwed up our order and or charged the wrong price. This place is a joke and we will never go there again!! If you live in Alton and want Taco Bell..go to the one on Homer Adams near Alby..much better!
285,Currently waiting for a extra most bestest and crazy combo. Been here 20 mins. I do not recommend this location.
286,"Literally the worst location I've ever been to.  The place literally smells like ass and is ALWAYS dirty.  The population surrounding it is poor so they never have any of the ""fancier"" items like lattes, smoothies, etc even though they have it on their menus and have the machines to make them.   It's really just burgers, fries and soda here.  I ordered a coffee here and they the woman gave me a sandwich bag with sugar and cream as they don't even have the modern machines where you push the buttons to add the condiments.  Those things were put into McD's over a decade ago.  Never go here."
287,Awful service... Manager sebina is very rube... Walked away from me while i was talking to her several times after her employees screwed my order up. Sat in drive thru for over 20 mins with 4 kids in the car while its 98 degrees outside. Finally after i thought they fixed my order i get home to find out it still isnt correct. I go back up there and im told i have to take the food away from my kids who just waited over 20 mins for to get refunded or for them to do anything... Customer service i called was just as worthless... Lady would only say i apologize. Not sorry or anything else... Just i apologize... Worthless people and i will never return
288,"Horrible!!!!!!!!!!!!!!!!!
I will never come here ever again. The service wasn't bad the the food was made sloppy. My sisters cheeseburger had hard bread on top and it was ripped on the side so they had to remake it. After drinking 3/4 of my drink I noticed mold on the side of my cup."
289,"This was probably the WORST McDonalds I've EVER been to. I have no clue how they could possibly be so slow at making nasty frozen food, sure enough their drive through service is absolutely horrific. I'm no sure what is wrong but every other McDonald's I've been to has been better than this. There is no way I would recommend this place to anyone in the world, and the only reason to ever come here in the future is if you're on a road trip and need to go to the bathroom!"
290,"I ended up paying $24 for a breakfast sandwich. When i called the store the man who picked up said "" hey nigger why don't you cry to your momma, this is MCDONALDS."" Really? I mean i guess thats it then.

*disclaimer: paid in cash"
291,"I haven't been to this McDonald's in a looooooong time because the employees here treat food like trash. But I thought maybe it had changed staff but no is stilI a shit hole. I ordered a breakfast burrito one time and got it all smashed good thing I checked before I left and I asked if it could be re-done and it was with an attitude like how dare I ask for my food to been well done when I'm paying for it...and well this time I tried to get a #1 after not coming here for soooo long and I asked for no onions please and Guess what people thats exactly what I got onions it was more of a big mconion as you can see in the picture.
Is like the person that made said oh no onions ok here you go extra onions....to that asshole that did it how about get another job if you don't like your job find something else to do you fucking looser...im done with this place covid19 has nothing todo with bad service this place has always been horrible...Wendy's near this McDonald's is soooooo much better. Dont waste your time and money here not worth it"
292,"Still garbage ..even in the wake of covid 19 and takeout only, with very few customers, they still cant manage to get it right. Warm orange absolutely NO ICE. Terrible customer service and this was with just me and one other person in the DRIVE THRU..the person taking payment had EXTREMELY LONG nails....everyone who eats here runs a risk. They just need to close this one down."
293,Went at noon. Waited 20 minutes and the tenders were cold and as if they were sitting awhile.i know you can do better.
294,"This place sucks, no managers, no general managers, no regional manager,  you are to pay and told to suck a big one and talk to cooperate, guess what, there is no one at cooperate! Never ordering from here again."
295,Just waited in the drive through line for 25 minutes...FOR TWO ICE CREAMS! So slow and rude.
296,Absolutely terrible customer service. Rude at the drive through speaker after we waited 10 minutes for them to even take our order and no one was in line but us. We then pulled up and paid for the meal where we waited another 10 minutes before being rudely told to pull up because our chicken fries were cooking we then pulled forward to wait another 15 minutes to bring the food out. Worst experience I've ever had at a fast food restaurant. Bad enough that my 6 year old asked to never go to Burger King again.
297,Trash. The owner should be ashamed. This takes 30 minutes to get an order of friends. Hopefully people get together soon to make change.
298,"I would give negative stars if I could! Went here Friday night before going to the movies. Big mistake! The fish was so overcooked that it was all crunchy, including the ""meat"" of it. The coleslaw had the consistency of Sludge, the gravy on the mashed potatoes was so cold that it was like gel. I took food back to the counter where the store manager stated that it wasn't like that when it was served to me! As if I had a deep fryer in my back pocket. I threw it out and will NEVER go here again."
299,"CLOSE THIS PLACE DOWN NOW!!!  My GOD! Is this America? I felt like I was in some 3rd world country. Who in The H*** Hires these people? Someone needs to take accountability for this disastrous place. The workers are completely inappropriate. FIRE EVERYONE AND CLOSE NOW! They ARGUE with customers... rude.. nasty... told my kids that they didn't have change for a twenty dollar bill.. our food came up to $11 and some change.. so basically they're saying that they couldn't give us about eight dollars back in any form at all....my kids had to come to the car to explain to me and when I went in to see what was going on..I was met with stupidity.. no explanation...and Oh! Magically they had change. When I walked out to wait in the car for my kids to come out with the food, my kids told me that the workers behind the counter started trash talking me and neck rolling and saying that I'm lucky that I walked out..... Dear Burger King: I [promise] you,  if anybody EVER threatens me in that place ever again, or make my children to feel afraid for ANY reason...You will be placed UNDER the jail. I feel sorry for ppl with No Form of Education. Is that how you plan to spend your life? Behind the counter of Burger King talking sh** and being an (F'ing) nobody for the rest of your lives? pick up a damn book and scratch your way up out of that ghetto mindset. Tragic...."
300,Just like everyone else that leaves a review. These idiots(or the other word if you prefer) never get it right and are rude
301,"Ha. Joke is on me for not trusting the reviews.  But when it's lent and Friday, LJS seems like a good idea in theory. 

We had the longest wait ever for a simple order that started in the drive thru. I then went inside because it took forever to bring the food out. Amazingly and unbelievably they LOCKED the doors to keep customers out because they could not handle more orders.  When someone let us in to pick up our ""drive thru"", the lead person working yelled who let them in?  We are not taking any more orders. 

Wow. Just wow."
302,"Do not call this place!!! I ordered a white pizza through grub hub at this place.They had a 15.00 minimum and a 11.00 delivery charge.I ordered at midnight and didn't get my food until 3am!!! No apology from the restaurant,
 nothing.The food was cold and was awful."
303,"The worst McDonalds I have ever been to. They didnt even take my order at the screen, they took it at the window and had me sit there for 5 minutes before telling me. I waited over 25 minutes for my food and watched all the workers stand around not working.... The person behind me got their food before i did. Never go here, i will never be returning."
304,"Looked into it this place its a scam , the location isn't even a pizza place it's and African clothing store. Don't know how this is even still up saying it's open"
305,"Just went here today one of the best McDonald's I've been to fries were AMAZING! Best I've had in a very long time

Had to revise! The fries were so good I went back for seconds only this time only 15 minutes later they were disgusting a pound of salt nasty flavor inedible, then I noticed my receipt and the drive in front of mines order on the screen.. No matter if you get a small soda or a McFlurry any drink they will add a 50 cent up charge with or without meal that is theft! Also I ordered the first fries with a coupon the second time they charged me $4.09 I think crazy high it's like 2.85 after tax around my way"
306,"Absolutely abysmal.  Rude and apathetic staff feels like they're doing you a favor by taking your order.  Have to pull around and wait for 15 minutes every time because it keeps the ""official"" window wait times good.  Regional manager needs to wise up and realize that the staff here is the worst in the Parish.  I give this place another shot every few months and every single time nothing changes and I'm reminded why I avoid this place.  Wise up and get a manager that can train and control their staff.  

This time I ordered 3 things and only got 2.  I should have known better and looked in the bag before I left.  Not worth the hassle of going back and waiting another 10 minutes for my missing hash browns.

SERIOUSLY, go ANYWHERE else."
307,I don't know why I even bother stopping. I mean you would think after the 500th time of it being crap or having the wrong order I would stop going but they got me by the neck because it's one of the few places on Telegraph. But here I am eating my crap burger without my fry and with a flat dr. Pepper. Place is a joke and the workers arnt of the best breed
308,"First time eating wingstop & will be my last time . It was horrible, everything was cold. Wings were so small & dried out . Can't believe i wasted my money on this garbage. DONT EAT HERE !!!!!!!!! Such a disappointment"
309,"I just came back from a trip to to McDonald's for my kids. I asked for a cheeseburger happy meal with just pickles and cheese on the burger. It had everything on it when I opened it. I got a 10 piece Nuggets with only 9 Nuggets in the box. I asked for extra ranch and they asked me to pay $0.50 for each one, but they couldn't even get my order near right. I didn't ask for any ketchup for my fries but instead asked only for Ranch, and they refused to give it to me without charging me and again I emphasize that they couldn't even get my order right."
310,"YUCK.  Seriously.  I wish I could post a photo so you could see what I got.  I ordered a pizza with DOUBLE EXTRA cheese, olives, tomatoes, and pepperoni.  The cardboard box it came in had more flavor than the crust.  Yes, I tasted it so I would know.  The pizza was burned.  And DOUBLE EXTRA cheese?  Yeah, no.  There is more cheese on a $1 Totino's pizza from the grocery store.  Totino's has better quality sauce too.  I did speak with the store manager, and he was SUPER rude and unhelpful.  

I wish I had something nice to say about this place because I do try to buy local, and I'm a really nice person.  But there was no redeeming quality.  I'm sorry.

Don't order from here."
311,This McDonald's can never get orders correct. And since the dining room is closed you either have to pull over and check the order (defeats the drive through) or hold up the drive through.
312,"went there to pick up lunch for employess today
have about 5 separate orders
one of the burger king employees behind the counter said
she should of gone to fkn mcdonalds with all those orders

really"
313,They have very rude staff and offers very bad service. In addition to that my last visit included being accused of lying about my order resulting in me being charged wrong.  Fun times.
314,"Ok they mess my order two weeks ago ,and I call the store back to let them know .. we'll the manager said come down on your next fee day .. I did today and those folks over at this restaurant made me paid for my food and then give me free food .. I didn't want the food I just want my meal at a discount rate .."
315,"If there is a Burger King in the world, that is worst than this one, I have yet to experience it. How are they still in business?"
316,"We went to wing stop and spent $70 on food. The really short girl that was reading me off the food I bought had a attitude. Then I wait for the 4 drinks I bought. I just heard her talking under her breath saying ""I don't have to be here"". And then threw down my drinks on the table Smh. I never experienced  this customer service in the last 6 years I been in Levittown.  Also the wings are much better at baileys bar."
317,"Warning, Taco Bell Springfield, TN has an employee not returning credit cards thru the drive up. Then going across the street at Walmart making changes until account in drained. Management was advised Three  hours after it happened wouldn't look at video to try and catch employee. Management didn't care are help."
318,"Absolutely horrible and would never order again. There were discrepancies with the order and I was yelled at and talked to in a rude tone being told ""I could not complain about more than one aspect of our meal and I could only pick one thing to be upset about"" and then he proceeded to tell me how incorrect I was and how the wings being inedibly rubbery were based on my personal preference, rather than the sheer fact that they were completely over cooked. I would NEVER order from the restaurant again or give them my business based on how I was treated and that alone. Regardless of the fact that I made a complaint on one aspect of my pizza,  which turned out to be me being wrong, I was yelled at and treated horribly and wasn't even able to speak a word in edgewise with him to admit I was wrong due to the repeating ""no you're wrong that's not correct"" yelling at me every time I tried to speak. 

On top of that, $50  spent and just moved to the area and this was our first meal in our new home in a new state and this gentleman completely ruined my evening and refused a refund of any sort and only offered a $20 credit for the horrible food we had already ordered and never wanted to eat again, and I would especially never give my business to someone who treats others in such a manor. Work on your customer service. I've NEVER in my life had an experience like this or left a bad review to make others aware of why they shouldn't give their money to this establishment."
319,"TERRIBLE! Rude, was told my food would take 20 minutes, waited over an hour and they still got my order wrong."
