,Reviews
0,"Wish I had read the reviews before we stopped for dinner.  When we arrived there were only two other tables of patrons and a handful of people at the bar.   They promptly took our food order, but we waited 50 minutes for it to be delivered.   It was only a burger and a pork tenderloin sandwich.   Not sure why we didn't leave other than the fact we were watching football.  Food was just ok.

The people at the bar were so loud, offensive and obnoxious that I felt uncomfortable for an older couple that was dining.    What kind of management allows this kind of behavior?   

This place won't last."
1,"Literally, the worst Taco Bell I have ever been to. The restaurant is filthy, the service is awful, and they didn't make any of our order correctly, and really, how hard is that?  I won't be back and if I were you I would find a different place to go."
2,"Slow service with an attitude, filthy dining and restrooms. Figured the first time they were having a bad day. Because I was craving Taco Bell thought I would give this location a second shot. There were two customers in line ahead of me and after waiting ten minutes to order and looking around at the state of the place I should have walked out. Guess I'm a sucker for punishment. Take notice and get this place shaped up !"
3,"Rude, inattentive, uneducated and they always make you feel that you are bothering them. I have started using mobile order because it's one less idiot to deal within the chain. When they start making $15 an hour we will be ordering from kiosks and maybe dealing with one person."
4,"I stopped going this BK and usually avoid all BK. 
I don't know if all BK are like this one or is this location uniquely bad. Whenever you pass by you never see many cars so you get tricked into thinking that you could get in and out fast. When they do answer to take your order, its never friendly or welcoming. Once i thought i heard someone say ""Yea, what u want"" but i will give the benefit of the doubt i miss heard. Nothing i order is complicated or special request so you would think it wouldn't take long. It seems as if they don't start until you have paid, because they ask for me to pull around. I understand if they were busy or off hours or something reasonable, but no. You can hear them holding conversations, that if were management they would be fired on the spot. You get a sense of not being welcomed as if your inconveniencing them. Then after waiting, they bring your order to your car and say nothing. No sorry for the wait, or bla bla.
I have learned the hard way to not leave until you check your food to make sure its 100%. 9 out of 10 times my order is wrong in some way. Either something is missing or they ignored my request all together. 
You then decide is it worth the possible wait time and rude service or just take it and leave. 
The last time i left i swore to never go back.
If someone from management reads this, if you want to know why your store is dying. Look at your employees first, then quality control."
5,"Oh, Heck No! We ordered 2 pizzas tonight: one new hand tossed and one thin and crispy. And I do use the word crispy lightly. Both these pizzas were limp and soggy. When we lifted the pieces from the boxes the tips pointed straight down at the table--and not because of the weight of the ingredients. Those were just ordinary. But, this thin and ""crispy"" crust was very crispy on the very outer edge, but wallpaper paste everywhere else. The hand tossed is a new product and I thought maybe they just hadn't gotten it perfected yet. It also was soggy and did a nose-dive to the table when lifted. Unfortunately, it was already after nine pm when they arrived and we decided to just eat what we could and call it a night. But, I thought about it and decided that maybe they didn't know and if everyone was silent, they would lose business and people would have bad experiences. So, I called and spoke to David, who identified himself as the manager on duty. I told him we had gotten pizza and that I just wanted to give him some feedback. He was very nice, polite and pleasant. I liked him. Until. Until he said that he had pulled up my order and that there were 6 toppings on one pizza and 9 toppings on the other pizza and so with so many toppings, it's hard for them to know how long to cook the pizzas. I thought about that a second and asked, ""so it's my fault for ordering too many toppings""? He said no and then explained again that with that many toppings it's too hard to judge how long to cook the pizzas. I told him then it should say on the website (I ordered online) that they don't recommend more than however-many toppings. He explained the problem to me again and I told him Dominos can cook a crispy pizza crust perfectly--and do a pretty good hand tossed, too. I said maybe I should call them and find out how to do it and call him back and tell him. I mean, how ridiculous! I asked for nothing comped, nothing like that. I was just giving the feedback and ended up being a bit flip with him and sitting here typing this because I'm mad instead of sleeping. With delivery and tip, I paid $30 for food that was barely eaten and will probably be thrown away in a few days. It'll dry out in the refrigerator, so maybe I can have it crispy after all. What idiocy.

I told him the Yelp review would be up in about an hour, so ""Hi, David!"" and I contacted corporate, too."
6,ive tried going here four times with no success because the drive tru takes so long that i have pulled away every single time. great job idiots!
7,"The owner of Popeyes used to send his mother to the drive thru once a week and report irregularities.  This bk must be a corporate store because of corporate like employees serving a human population.
Soggy (or oil tainted) tater tots, but everything else is made fresh.  That means EVERY customer has to ""please pull around because they are so fresh they are just coming out of the oven"".   Then they forget caramel in a specialty coffee, or a drink that goes with the combo they are holding.  Breakfast is a disorganized mess.  Definitely not a place you want to go when you are in a hurry.  It's a slow food, or pull around & wait establishment....would not recommend to anyone for breakfast.  Maybe it was due to the Monday's????"
8,"Why does it say online. Open 24/7 everyday but, there always saying the store is closed at night. Even the drive thru is closed 3 days a week at night. Also the staff is ignorant. #BlackOwnedBusinesses"
9,"Stood in line (2nd in line) for 20 minutes one guy in front of me waiting on the cashier , the cashier was just standing there smiling taking the sweetest time ever possible I could have gotten to a log john silvers in Texas before he pressed a button on the register. The food was poorly made thrown on a plate and served after another 20 minutes of waiting. I could have went to the gulf and caught my own fish to filet them myself quicker than they threw  this ""fast food"" together. Fish wasn't the same as the LJS in goodlettsville before it shut down. The one in goodlettsville was the best one ever! There should be more of the around. Captain d's is a joke compared to LJS!"
10,"This has got to be the worst experience we've had in a very long time. First of all, they don't deliver to our home. But we were in the mood for stuffed crust, so we ordered online for pickup. We got our email confirmation for order complete time at 5:30, and I noticed one of our  pizzas was wrong so I called right away. The girl I spoke to on the phone confirmed she has changed it. So when my husband gets there at 5:35. the pizzas aren't even ready. And surprise, surprise the order is WRONG. There were only 2 people working, and he didn't want to wait. He gets home, and the pizzas are borderline cold, like they've been sitting there. It was just a horrible experience and will never order/eat at a Pizza Hut again. Bye, Felicia!"
11,"The two waiters/cooks were sitting down in the dining area when we arrived. Noticed there wasn't any else and that should have been a red flag. The waiter was loud and awkward. Their phone rang multiple times and they ignored it. They were out of tea, but brewed some. Noticed a lot of tables had not been wiped down. Others walked in and waited,  but left after not being acknowledged. Then noticed the section that was closed off awaiting vacuuming. Staff were loud about their job dissatisfaction. We should have left, but I was hungery. Brought out one pizza, no silverware or napkins. Had to ask for them specifinally. Food was okay. They finally answered the phone and talked with a customer who never received their order. Pepsi was off,  so they gave out litre bottles.  This was the strangest, most bizarre place I've ever visited. They lied to customers calling in about how busy they were and openly complained about customers. It was intriguing to watch, but never going to eat here ever again."
12,You get to wait 20 minutes even when first in line at the drive thru window. Now worth it - even of their fries are die-worthy!
13,"Really this should be Zero stars. I'm not sure how this particular location can be consistently bad for so long. I live not far from this location, but I will usually drive farther to another location because from top to bottom this location fails. Every once and a while, like today, I'll stop by and see if they were able to turn it around. Well, I'm sad to say that they still are awful. I'm really shocked that this location is able to stay in business this long. 
I went through the drive thru and ordered a KFC value meal. 15 minutes later I got my food. Apologies? Are you kidding? I had clearly inconvenienced the staff by being a paying customer. They essentially tossed me my food without saying even ""thank you"" or ""come again"". I drove away (my mistake) and noticed when I got home that my drink was wrong, I received no napkins and no plastic ware. 
Overall, this place has consistently the worst fast food staffing that I have ever seen. Who ever manages this location should be ashamed and consider another profession. Do yourself a favor and go to the Wendy's next door, they are consistently good."
14,"Even in the middle of lunchtime on a weekday, food is cold-old. With that odor associated with something that as waited too long, where flavor transmutes to an impatient attitude. You could maybe account for this by imagining the burger, fries, and fish sandwich had been prepared at some suburban McDonalds and then trucked over to this urban outlet to be re-heated and allow to age a bit. This is an insult to the neighborhood."
15,I'm really not sure how this location is still in business.  Staff is uninterested in actually helping you.  Food is ehhhhhh!  There are so many good places to eat.  This ain't one of them.
16,"This location is supposed to be open until 1 AM and I came up at 10 PM and it was closed. I think it's fair to mention that all of these other reviews are correct in saying that it will take you about 30 minutes to get your food every time you come here. The only reason that I came this time was because it's close to my house and I was hungry after working all day, but of course they weren't even open during their normal hours."
17,"Employees try to avoid eye contact in order to pretend you're not there. I waited 5 minutes at the counter only to have no one approach me to take my order. I departed letting them know that I would put in a complaint. No surprise, no one got back to me on my complaint."
18,I feel like you have to TRY to screw up orders as bad as they do. Not only that but we had an experience once when I was there with my 2 kids and 2 employees were screaming at each other. They were cussing and finally one left. I got her name and called corporate to complain- never heard back. Next time we went in (we always went before PSR on Wednesdays) that employee was there again. I can't believe she wasn't fired for screaming and cussing in front of kids!
19,This is the slowest drive through I have ever been in my entire life not sure how this survives why people continue to come back here
20,"I placed my order at 6:05 pm. It's now 8:25 pm. I have still not received my order. When I called the person that answered the phone he was extremely short and rushed me off the phone. No apology. No refund. Just extremely rude. I called them 4 times and two of the 4 times he put me on hold or hung up. I only selected this restaurant due to it saying a delivery time is 45 minutes. Customer service can and should go a long way to make any organization thrive. This company needs to figure out a plan of action to get this fixed or they will not last long. Even a simple courtesy call to say we are running behind would have gone a long way. I still am hopeful my food comes soon because I'm still hungry. If the food is good, I'll be sure to let you all know if and when it ever arrives."
21,"Worst experience ever! Not only did they not deliver my food, but they claimed they tried knocking... I never once heard them.. I called them back letting them know that I would no longer be wanting the food and to just forget it. The manager said it was complementary and that a driver was on his way.. 40 minutes later still no food.. Manager even stated that it was due to the ""idiots"" in their store.. never ordering from here again.. Domino's has never let me down.. should not have switched it up tonight."
22,Sat in the drive thru for over ten minutes as the only customer.  I never got my order taken even though I tried to get the attention of the drive thru worker.  I ended up just leaving.
23,I work 3rd shift and get off at 2am and there is very few places that are 24hrs. Twice in two nights i was denied a burger. They said the grills are down then i asked for milkshake they said milkshake machine is down. Then on a 3rd occasion i was served food but after i didn't get a response in drive thru i drove around and they were all outside smoking.  Im done with this place. People don't wanna work apparently at this time of night. They shouldn't be open 24hrs to waste people's time.
24,"Stopped in today for a quick bite and to use the restroom.  I hate to be negative but oh my god the lobby was dirty.  The men's restroom was out of order.  I ordered 1 burrito, I'm not kidding I waited over ten minutes for that burrito.  They weren't even busy come on Taco Bell.  Fix this this place was nasty, my next phone call will be to the Health Department EWWWW!!!!!"
25,"Worst Taco Bell I've ever been in and I know they are fast food and not some fancy place. Been several times. They never have any ice in the machine out front, and the beverages are flat or stale. The trash cans are running over and the service is slow. Won't be back.  I can only imagine how they prepare the food. Really don't want to think about that."
26,"This place sucks
Worse than Shenanigans

Food.....so so
Service.....Horrible
Management.....Clueless

New owner, same garbage"
27,"First time I ordered,they said it would be an hour wait,my husband called after an hour and 30 mins,they said our pizza was on its way. We waited another 45 minutes or so before calling again,they  apologized,gave it to us for free then finally delivered it. When we got it both pizzas were wrong and ice cold,since they were free we didn't call back. Today we decided to give them another chance,they said 2 hours this time so my husband called them back and said he would just pick them up. He went up there to pick them up and they said the driver was on his way to our house,my husband came home,then they called and said the driver came back to the store and we just told them to deliver it because he was already home,we waited about 40 minutes and they call again saying ""the driver broke down so we have to pick it up"". We just moved to the neighborhood so 2 out of 2 bad experiences is enough for me,never again will I waste my time ordering from this clueless location!"
28,"I LOVE LJS fish, & it's been ages since having some. So, yesterday evening we went here despite the reviews. We went with eyes wide open, knowing the service would suck. It did. Food was good, but waiting in line was forever as cashier cut up with employees & customers ahead of us, who were apparently family as we noted they didn't have to pay very much...finally a manager came up from the back & told dude to just clock out & leave if he was just going to cut up. He did. As I said, food was good...when we finally got it. Table & booth were almost adhesive with old grease, though. Nasty. Health inspection was noted to be a 98, but with the lack of cleanliness, I can't imagine how. Next time, I'll wait forever, but get it to go."
29,"I thought the first time I went there, they were just having a bad day.  So I returned a second time.  Never again!! The service is a joke...20 mins to get my order and it was wrong. The stupid leading the stupid.  Management should be ashamed for hiring the most incompetent people in Indianapolis.  One question for the employees... What are you going to do with your life if  you can't even make a taco???"
30,"Stood in line (2nd in line) for 20 minutes one guy in front of me waiting on the cashier , the cashier was just standing there smiling taking the sweetest time ever possible I could have gotten to a log john silvers in Texas before he pressed a button on the register. The food was poorly made thrown on a plate and served after another 20 minutes of waiting. I could have went to the gulf and caught my own fish to filet them myself quicker than they threw  this ""fast food"" together. Fish wasn't the same as the LJS in goodlettsville before it shut down. The one in goodlettsville was the best one ever! There should be more of the around. Captain d's is a joke compared to LJS! 

8-16-17  , came back to try it out, same guy at the register taking his time to give me 3 dollars back, out of tartar sauce, fish is dry, how is this place still in business?, where is the GM for this place?.. they need new employees and tartar sauce."
31,This is one of the worst McDonalds on ever been to it's so dirty the food is horrible customer service is the pits it is one of the worst worst McDonald's ever been into very unsanitary don't eat here
32,"Continuously ** HORRIBLE SERVICE** They say its a training store, then some needs to train the trainers. Made a simple order no special request and still... could not get it right... 9:45 AM Sunday Morning... If at all possible GO SOMEWHERE ELSE"
33,Wow what can I say this kfc Taco Bell combo is the worst. I wanted some tacos to take home and they had no beef what in the world. None of the tables were clean. The workers were yelling while they were working. Just a bad place to eat.
34,I order delivery from this location now less and less     When I have ordered the last few times I have not received my gift cards or movie passes. My delivery last night included a steak Caesar where they threw the meat on the salad and then the dressing and croutons on top of it making the dressing slimy to hold and also how is this food safe?? I will let you judge by the picture if you would want to eat this.
35,"Wow! Not sure that I could add much more to what has been voiced in the prior reviews. I hear that the Sunday brunch is OK. However my experience in dining there for dinner was perhaps the worst ever. To recap, lousy food, horrible service, and an atmosphere that is ridiculous for a place serving food. The place should do everyone a favor and shut down the kitchen and make money off the drunk and obnoxious bar patrons. I wish that Yelp had a zero star rating."
36,"I am absolutely disgusted and will NEVER eat at Taco Bell after the experience I just had. I arrived home with my to-go order which included 3 tacos. Upon opening the 3rd taco I was stunned and sickened to find a BANDAID in the wrapping of my taco. And yes... I took multiple pictures. I tried to call the location but surprise surprise... no answer. 

NEVER AGAIN will I go near this place or Taco Bell in general for that matter."
37,I want to preface this with that I don't post many reviews but I felt the need to after tonight.. I started going to this location because of the elsmere subway was awful. The staff here are great and very helpful however after getting out of class and stopping at this location I witnessed a small bug which looked like a small roach crawling around fairly close to the food.. I would have rated this a 4 out of 5 normally but now this location will be added to my list of ones to avoid.
38,"Awful extremely salty food.  I order the same thing at every McDonald's I ever go to and for some reason the artisan chicken sandwich was extremely salty.  I asked called (which I almost never do with fast food joints), and spoke to a snippy female 'manager' and was told to stuff either bring the sandwich back - which I had fed to my dogs by this time.  No refund, no replacement.  The manager gave me 'corporate's' number to call.  I did and spoke to Dot.  After a lot of back and forth with Dot, who had said she was the owner, and then said she wasn't.  She claimed the manager was right, I said fine, keep the money I'll just write an online review.  Then she put me on hold to consult with the 'owner' and came back and offered me a refund if I could give her the precise time I could go back to the store.  I couldn't. So she offered coupons.  I said fine as long as they covered the artisan grilled chicken sandwich which is all I order from McDonald's.  Watch this space.  I will delete the review if I receive a satisfactory resolution."
39,"Like the others, I sat in their drive thru for 20 plus minutes. They truly don't give a crap about customers. Probably not the employees' fault, I'm sure it's just two in there..."
40,"The drive tru is under construction, but not inside, well it look the oppsite. They are not ready to take care of the customers. Poor customer services and dirty place. The beverage area is dirty.  The lids are all over the place. No straws. No ice in the dispensers, and the serving soda machine area is dirty. They do not have happy meal toys. I was told the only thing they have is whatever they get left from other times. 
The guy at the register has his headphones hanging from his ears and asking what I had order. The other employee just standing there. I looked inside my bag with food and no ketchup so I asked her for some and she slide a ketchup bin towards me. As I was walking towards the door I heard her tell the other employee thats why she does not put ketchup out for people to grab because they take everything. Well, thats why you should prepare the orders with everything it needs so customers do not interrupt your personal conversation."
41,Probably the worst sub I had here. The two ladies here are degrading the name of subway. They don't understand the offers which are written in English. I had a coupon which says any footlong sub for $5 but these uneducated ladies could not understand what it is and I have to pay the full price.
42,"They give new meaning to fast food, meaning you will wait an eternity to get your food.  The one consistent thing about this place is bad service all the time they never disappoint in this area."
43,"This McDonalds would not have any stars if it wasnt for the actual food tasting pretty good  and looking presentable, as compared to some fast food places that throw a burger together.  
I placed an order through the mobile order app, and 1 order was for a buttermilk crispy sandwich which went smoothly and the 2nd order was for an Oreo frappe and fries Just like any other time that I would do a mobile order I approach the drive-through and simply told the employee that I had ordered a mobile order and I would simply give a reference number and my order would be complete. This time, I pulled up to the window and had to repeat several times my order my order number and so on and so forth after about three times the lady just stop talking she didn't respond after several attempts to get her attentionSo I pull up to the next window and the gentleman was very polite and he did say that he wasn't quite sure about the mobile order and that I should come inside so I decide to do so. Once I came inside not only was the woman who I spoke with extremely rude at that point as well I also came to find she was a manager. I was approached with ""you got the crispy chicken right?"" And threw the bag down I told her yes I was but I had also ordered another item the Oreo frappe and french fries and it was her comment that was my shocking and she says well I didn't see that on my screen. So I was not going to receive that Oreo frappe or french fries X even after showing this manager my receipt on my mobile app for payment. The manager that time said it was not her problem was I had paid for it or not it was not her screen so it's not heProblem I told her it indeed was her problem and in fact does not mind considering she was the manager there now mom story short they were extremely extremely unprofessional they had the least amount of class I've seen in a very long time and just very very rude 
And that's all without mentioning I didn't recieve my fries I paid for or the credit fowards buy 5 McCafé/ 1 free"
44,Went through drive thru twice for 3 soft taco supremes and 1 burrito supremes only to have the orders wrong a rude manager and really cold tacos and all got said well its cold because they sat it at the window while someone cooked the burrito supreme!!! I work fast food and I know this is not how you do a customer!!!
45,"Shop around and find a different mover.  The movers were nice people.  I am not sure how these folks stay in business.  Unsuccessful in almost every regard.

Find someone else."
